Type,ID,Title,S1,S2,S3,S4,S5,S6,S7,S8,Sentence
P0399,191,“天然泻药”被发现，一周吃几次，排出宿便降体重，简直福音,小肚腩,积累小肚腩,,,,,,,我每天为了瘦小肚腩坚持运动，后来一个运动认识的朋友告诉我，平时应该多吃一些有助于排宿便的菜，这样可以清除肠道，让体内的油脂变少，才不会积累小肚腩
P0004,192,3类人的肝脏属于“易胖体质”，肝癌风险也在升高,胖不起,,,,,,,,03 你的内脏迫切该减脂了 肝脏真的胖不起
P0181,193,何洁与家人清迈度假，体重反弹胖了有15斤，打扮倒是没那么土气了,手臂肉肉的,肩膀宽厚,没有腰身,,,,,,身着白色背心的何洁露出的手臂肉肉的，肩膀宽厚并没有腰身，而按照何洁之前说的瘦到了90斤的说法，她现在这体重应该是反弹了，用网友的话来说看着胖了有15斤
P0169,194,什么时候才能停止对马思纯身材的审视？,微胖女孩,魅力,,,,,,,因为生病吃药导致身材一度浮肿发胖的马思纯，有自己的一套有效的减肥经验——坚持下去就会发现自己焕然一新的一面
P0871,195,【美女】对不起！男人眼中的微胖，长这样,微胖女孩,魅力,,,,,,,如果你还不明白，那么接下来，让我们一起感受一下微胖女孩的魅力
P0164,196,亚洲首富之子减肥超200斤，又胖回去了！近照曝光,似乎又胖回来了,,,,,,,,然而，人们惊讶地发现，婚前派对上的他似乎又胖回来了
P0807,198,三分之二澳人超重或肥胖 营养师提醒重点关注中央肥胖,肪堆积在腰部,中央肥胖,升高患很多慢性疾病的几率,,,,,,Lisa说：“如果脂肪堆积在腰部的话就比较危险，这就是我们说的中央肥胖，确实是会升高患很多慢性疾病的几率
P0101,199,一个人胖不胖，看“圆度指数”，比 BMI 更靠谱,中心型肥胖,,,,,,,,按照我国人群标准，男性腰围≥90cm，女性≥85cm 即可诊断为中心型肥胖
P0085,200,研究显示:面包燕麦酸奶...长期吃这类食物会变胖还变傻,摄入糖份,变得肥胖,,,,,,,与此同时，越来越多的研究都在警告人们，摄入糖份的危害，它不仅让人变得肥胖，过度紧张、还会引起糖尿病、高血压、心脏病、通风等疾病
P0816,201,國會委員會籲全澳學校供餐 改善學生健康, 腹部肥胖,,,,,,,,代谢综合症的诊断标准通常包括以下5个主要风险因素，患者具有其中三项或以上，则被确认患上代谢综合症： 腹部肥胖 高血压 高血糖 高三酸甘油脂 低高密度脂蛋白（HDL）胆固醇 Advertisement 代谢综合症对健康影响深远，主要包括： 增加心血管疾病风险：如冠状动脉疾病、心脏病发作
P0365,202,大叔因跟好莱坞明星莱昂纳多惊人相似意外走红！近期却不幸失业因为，发福了...,胖版小李子,体重仍然没下来,,,,,,,刚出道时候的宣传人设就是胖版小李子 疫情期间的样子： 他曾发誓要在 2021 年减肥，并表示他将在“2022 年新年”之前“达到最佳状态”，但如今，这位大叔体重仍然没下来
P0394,203,面相变了!贾玲最新露面 体重竟反弹回归原状,胖胖的,浑身肉感十足,笑起来那憨态可 掬,特别招人喜欢,,,,,想当初，胖胖的贾玲浑身肉感十足，笑起来那憨态可 掬的模样特别招人喜欢，可如今减肥成功后再一笑，却好似把一些之前未曾注意到的缺点暴露了出来
P1095,204,欧阳娜娜「腰间肉溢出」画面疯传！网一看全愣了：太尴尬,腰上勒的那两坨肉,太尴尬,,,,,,,」、「腰上勒的那两坨肉太尴尬了」
P0605,205,中年發福不是福 腰圍超標是警訊,中年发福,肚子变大,健康容易逐渐走下坡,,,,,,"中年发福和肚子变大是许多中年人会面临的问题,如果习以为常或轻忽不管,健康容易逐渐走下坡"
P0645,206,清华学霸杀妻案又开庭！拖了359天还没初审，凶手却养得白白胖胖…,明显有些发福,,,,,,,,去年6月7日，第二次认罪听证会，陈终于入座法庭被告席，且明显有些发福
P0009,207,7个不起眼的小习惯，其实可以养肝,体重超标,胖在了肚子上,,,,,,,体重超标的人，很多都胖在了肚子上，尤其是肝脏、肠道等内脏
P1059,208,“重”视体重，“轻”松生活：肥胖问题我们说清楚,腹部肥胖,内脏脂肪多,健康隐患,,,,,,腹部肥胖、内脏脂肪多也可能埋下健康隐患
P0685,209,澳洲专家建议“封杀”圣诞老人！说会教坏小孩！原因竟然是因为太胖？？？,胖乎乎,,,,,,,,辣妈看来 圣诞老人一直以来都是圣诞节 的传统形象代表 胖乎乎又慈祥的老爷爷 是每个孩子美好童年的回忆 我们可以接受花式圣诞老爷爷 但是真没必要一票否决哦
P0130,210,中国男人配不上中国女人？,普遍,发福,与他们常去的地方有关,,,,,,政商界男性普遍发福，与他们常去的地方有关
P1084,211,陈飞宇曝私照后复出，自曝225斤瘦下来全靠跑步，因太胖被排挤,太胖,过得非常痛苦,被同学排挤,体育成绩也特别 差,自卑,,,,他曾透露因为太胖，自己在中学过得非常痛苦，不仅被同学排挤，体育成绩也特别 差，久而久之性格也开始自卑了
P0869,212,【美女】130斤的健身小姐姐有多绝？！大码的“粗腿肥臀”太炸了,多肉微胖,吸人眼 球,,,,,,,好身材绝对没有固定的模板，并不是体重越轻就越好看，多肉微胖也照样吸人眼 球
P0245,213,内马尔最新照片大变样 明显发福成“肉马尔”,略显发福,长胖了,,,,,,,近日，还在养伤中的巴西球星内马尔现身罗马里奥58岁生日派对，从现场照片来看，内马尔略显发福，不知是角度问题还是真的长胖了
P0524,214,拒绝中年“发福”，从这12件小事入手，生活化“减脂”！,中年,发福,,,,,,,但我拒绝中年的发福，我决心通过一些生活中的小事来控制体重，实现健康减脂
